Source,Author,Title,Description,URL,Published At
The Times of India,AP,The Biden administration once more bypasses Congress on an emergency weapons sale to Israel,The Biden administration bypasses Congress for the second time to approve an emergency weapons sale to Israel amidst international criticism of Israel's war against Hamas in Gaza. Secretary of State Antony Blinken made an emergency determination for a $147.5 …,https://timesofindia.indiatimes.com/world/middle-east/the-biden-administration-once-more-bypasses-congress-on-an-emergency-weapons-sale-to-israel/articleshow/106393839.cms,2023-12-30T03:54:12Z
The Times of India,AFP,Kibbutz confirms two Israeli hostages 'murdered' in Gaza,"An Israeli kibbutz on Tuesday confirmed that two hostages whose deaths were announced by Hamas in a video had been ""murdered"" in Gaza after they were taken to the territory on October 7. In the unprecedented October 7 attack that triggered the Israel-Hamas wa…",https://timesofindia.indiatimes.com/world/middle-east/kibbutz-confirms-two-israeli-hostages-murdered-in-gaza/articleshow/106910002.cms,2024-01-16T23:08:00Z
The Times of India,AP,South Africa launches case at top UN court accusing Israel of genocide in Gaza,"The Israeli government ""rejected with disgust"" the South African genocide accusations, calling it a ""blood libel."" A Foreign Ministry statement said the case lacks a legal foundation and constitutes a ""vile exploitation and cheapening"" of the court.",https://economictimes.indiatimes.com/news/international/world-news/south-africa-launches-case-at-top-un-court-accusing-israel-of-genocide-in-gaza/articleshow/106388730.cms,2023-12-29T19:04:00Z
The Times of India,AFP,Israeli defence minister unveils plan for post-war Gaza,"Israeli Defence Minister presents post-war Gaza plan: no Hamas or Israeli governance. Goals include hostages' return, dismantling Hamas, eliminating threats. After, unspecified Palestinian bodies to govern, no Israeli civilians in Gaza. Calls for settlers' re…",https://economictimes.indiatimes.com/news/international/world-news/israeli-defence-minister-unveils-plan-for-post-war-gaza/articleshow/106556459.cms,2024-01-05T00:59:28Z
The Times of India,AP,"As Israel-Hamas war reaches 100-day mark, here's the conflict by numbers","In the longest, bloodiest Israel-Hamas war, ongoing for 100 days, relentless Israeli attacks have devastated Gaza, displacing Palestinians, shutting hospitals, and causing famine. Hezbollah and Israel engage in daily skirmishes. Stats reveal staggering human …",https://economictimes.indiatimes.com/news/defence/as-israel-hamas-war-reaches-100-day-mark-heres-the-conflict-by-numbers/articleshow/106829006.cms,2024-01-14T04:56:14Z
The Times of India,Reuters,"Blinken seeks to avert wider war, Israel says it is not fighting a single enemy",US Secretary of State Antony Blinken warns that the Gaza war could spread across the region without concerted peace efforts. He holds talks in the United Arab Emirates and Saudi Arabia before heading to Israel. Israeli Defence Minister Yoav Gallant says the i…,https://timesofindia.indiatimes.com/world/middle-east/blinken-seeks-to-avert-wider-war-israel-says-it-is-not-fighting-a-single-enemy/articleshow/106629065.cms,2024-01-08T06:47:56Z
Al Jazeera English,Al Jazeera,"Israel-Hamas war: List of key events, day 86","At least 100 killed in central Gaza, while night-time raids injure 17 in occupied West Bank - here is the latest.",https://www.aljazeera.com/news/2023/12/31/israel-hamas-war-list-of-key-events-day-86,2023-12-31T12:56:12Z
Al Jazeera English,Al Jazeera,"Israel-Hamas war: List of key events, day 85","South Africa files case of genocide against Israel, as attacks continue in Palestine and Lebanon – here is the latest.",https://www.aljazeera.com/news/2023/12/30/israel-hamas-war-list-of-key-events-day-85,2023-12-30T06:29:35Z
Al Jazeera English,Al Jazeera,"Israel-Hamas war: List of key events, day 84",Gaza's hospitals are running out of supplies and capacity for those injured in Israeli attacks - here is the latest.,https://www.aljazeera.com/news/2023/12/29/israel-hamas-war-list-of-key-events-day-84,2023-12-29T09:39:38Z
Al Jazeera English,Al Jazeera,"Israel-Hamas war: List of key events, day 83",Israel is in the middle of a major raid in Ramallah as Gaza continues to be hit - here are the latest updates.,https://www.aljazeera.com/news/2023/12/28/chk_israel-hamas-war-list-of-key-events-day-83,2023-12-28T08:42:08Z
Al Jazeera English,Mat Nashed,Has Israel realised that it can’t ‘eradicate’ Hamas?,"Israel vowed to eliminate Hamas, but now the group has resurfaced in northern Gaza after 112 days of war.",https://www.aljazeera.com/news/2024/1/26/israel-hamas-resurface-north-gaza,2024-01-26T07:48:05Z
Al Jazeera English,Mat Nashed,Has Israel realised that it can’t ‘eradicate’ Hamas?,"Israel vowed to eliminate Hamas, but now the group has resurfaced in northern Gaza after 112 days of war.",https://www.aljazeera.com/news/2024/1/26/israels-war-aim-since-october-7-has-been-to-eradicate-hamas-but-now-the-army-appears-to-acknowledge-that-they-are-still-very-far-away-from-that-goal,2024-01-26T07:48:05Z
Al Jazeera English,Al Jazeera,EU foreign policy chief says world must ‘impose’ solution to Gaza war,Josep Borrell warns that the killing of a Hamas leader in Lebanon could lead to an escalation of the Israel-Hamas war.,https://www.aljazeera.com/news/2024/1/3/eu-foreign-policy-chief-says-world-must-impose-solution-to-gaza-war,2024-01-03T16:31:27Z
Al Jazeera English,Zena Al Tahhan,How Israel has repeatedly rejected Hamas truce offers,"On Sunday, Israeli PM Benjamin Netanyahu turned down a Hamas offer to end the war. It's only the latest such instance.",https://www.aljazeera.com/features/2024/1/22/how-israel-has-repeatedly-rejected-hamas-truce-offers,2024-01-22T10:34:40Z
Al Jazeera English,Al Jazeera,Australia outlaws Nazi salute and hate symbols,"The law is introduced amid a surge in anti-Semitic and hate crimes, driven by the Israel-Hamas war.",https://www.aljazeera.com/news/2024/1/8/australia-outlaws-nazi-salute-and-symbols,2024-01-08T08:25:16Z
Al Jazeera English,Al Jazeera,Israeli minister says only a deal can free captives as rifts split cabinet,Gadi Eizenkot's comments come amid disagreement in the war cabinet about how to handle the war in Gaza.,https://www.aljazeera.com/news/2024/1/19/israeli-minister-says-only-a-deal-can-free-captives-as-rifts-split-cabinet,2024-01-19T15:24:08Z
Al Jazeera English,Al Jazeera,Hezbollah leader warns Israel of war ‘without restrictions’,Hezbollah leader warns Israel of war 'without restrictions',https://www.aljazeera.com/program/newsfeed/2024/1/3/hezbollah-leader-warns-israel-of-war-without-restrictions,2024-01-03T20:17:28Z
Al Jazeera English,Al Jazeera,Israel reportedly pushing deal for captive release without ending war,"A US envoy is visiting Egypt, Qatar to try to broker the deal as pressure rises on Tel Aviv to bring hostages home.",https://www.aljazeera.com/news/2024/1/23/israel-outlines-new-truce-proposal,2024-01-23T07:55:58Z
Al Jazeera English,Al Jazeera,Are Israel and Hezbollah on the brink of war?,Al Jazeera’s Zeina Khodr explains the Israeli strategy behind the army’s recent strikes into Lebanon.,https://www.aljazeera.com/program/newsfeed/2024/1/9/are-israel-and-lebanon-on-the-brink-of-war,2024-01-09T17:53:42Z
Al Jazeera English,Al Jazeera,Jordan’s King Abdullah II presses Blinken to push for a ceasefire in Gaza,The top US diplomat is travelling across the Middle East amid growing calls for a ceasefire in the Israel-Hamas war.,https://www.aljazeera.com/news/2024/1/7/jordans-king-abdullah-ii-presses-blinken-to-push-for-a-ceasefire-in-gaza,2024-01-07T14:56:02Z
Al Jazeera English,Al Jazeera,"Israel’s war on Gaza: List of key events, day 89",A drone strike in Lebanon killed senior Hamas official Saleh al-Arouri - here are the latest updates.,https://www.aljazeera.com/news/2024/1/3/israels-war-on-gaza-list-of-key-events-day-89,2024-01-03T07:59:14Z
Al Jazeera English,Al Jazeera,"Israel’s war on Gaza: List of key events, day 108",Netanyahu rejects a deal with Hamas to end the war while diplomatic efforts continue amid Israeli bombing of Gaza.,https://www.aljazeera.com/news/2024/1/22/israels-war-on-gaza-list-of-key-events-day-108,2024-01-22T08:28:37Z
Al Jazeera English,Al Jazeera,What does a ‘new phase’ in Israel’s war on Gaza entail?,Israel says it will withdraw some troops from the besieged Gaza Strip.,https://www.aljazeera.com/program/inside-story/2024/1/2/what-does-a-new-phase-in-israels-war-on-gaza-entail,2024-01-02T18:43:09Z
Al Jazeera English,Zoran Kusovac,Analysis: Has Israel weakened Hamas enough to win the war on Gaza?,"As 2023 draws to a close, how strong is Hamas after nearly three months of bombardment and ground invasion?",https://www.aljazeera.com/features/2023/12/30/analysis-has-israel-weakened-hamas-enough-to-win-the-war-on-gaza,2023-12-30T19:06:29Z
Al Jazeera English,Tony Greenstein,Israel’s war on Gaza triggered a war on free speech in the West,I was arrested over a single tweet I wrote in support of Palestinian resistance against Israel's military.,https://www.aljazeera.com/opinions/2024/1/17/israels-war-on-gaza-triggered-a-war-on-free-speech-in-the-west,2024-01-17T10:23:58Z
Al Jazeera English,Al Jazeera,Reporter’s Notebook: Covering an anti-war protest in Israel,Videographer Alasdair Brenard recounts being at Israel's first-ever anti-war rally since the war began.,https://www.aljazeera.com/editorial/2024/1/21/reporters-notebook-covering-an-first-antiwar-protest-in-israel,2024-01-21T21:52:45Z
Al Jazeera English,"Mat Nashed, Simon Speakman Cordall",Israel’s 100 days of relentless war on Gaza,"Alternating between justifications and claims of adhering to the rules of war, Israel wants to continue its war on Gaza.",https://www.aljazeera.com/features/longform/2024/1/14/israels-100-days-of-relentless-war-on-gaza,2024-01-14T15:51:54Z
Al Jazeera English,Al Jazeera,"Israel’s war on Gaza: List of key events, day 100",Israeli raids plunge Gaza into new communications blackout as Namibia slams Germany for its support of Israel at ICJ.,https://www.aljazeera.com/news/2024/1/14/israels-war-on-gaza-list-of-key-events-day-100,2024-01-14T08:31:14Z
Al Jazeera English,Al Jazeera,"Israel’s war on Gaza: List of key events, day 113",Top UN court orders Israel to prevent acts of genocide in Gaza; US and UK conduct new attacks on Houthi targets.,https://www.aljazeera.com/news/2024/1/27/israels-war-on-gaza-list-of-key-events-day-113,2024-01-27T08:04:05Z
Al Jazeera English,Al Jazeera,"Netanyahu rejects Hamas deal to end war, release captives",Israeli leader says soldiers will have “fallen in vain” if he accept Palestinian group's terms to end the war.,https://www.aljazeera.com/news/2024/1/22/netanyahu-rejects-hamas-deal-to-end-war-release-captives,2024-01-22T03:27:32Z
Al Jazeera English,Al Jazeera,Israel rejects accusations of genocide in Gaza war at ICJ hearing,Israel argued that there was a lack of evidence that proves 'genocidal intent' in its war on Gaza.,https://www.aljazeera.com/news/2024/1/12/israel-rejects-accusations-of-genocide-in-gaza-war-at-icj-hearing,2024-01-12T14:44:15Z
Al Jazeera English,Al Jazeera,Day one of the ICJ genocide hearing against Israel: Key takeaways,South Africa laid out a list of alleged genocidal acts by Israel while seeking an injunction against the war.,https://www.aljazeera.com/news/2024/1/11/day-one-of-the-icj-genocide-hearing-against-israel-key-takeaways,2024-01-11T17:01:16Z
Al Jazeera English,Al Jazeera,Blinken says US wants to see end to Israel-Hamas war,US Secretary of State Antony Blinken spoke to reporters following his meetings with Israeli leaders,https://www.aljazeera.com/program/newsfeed/2024/1/9/blinken-says-us-wants-to-see-end-to-israel-hamas-war,2024-01-09T20:33:26Z
Al Jazeera English,Al Jazeera,US to send top diplomats to Middle East as regional tensions spread,US Secretary of State Blinken due to visit as Israel’s war on Gaza widens to Lebanon.,https://www.aljazeera.com/news/2024/1/4/us-to-send-top-diplomats-to-middle-east-as-regional-tensions-spread,2024-01-04T12:42:57Z
Al Jazeera English,Al Jazeera,Israeli defence minister outlines new phase in Gaza war,Yoav Gallant says Israeli officials want a 'Palestinian entity' to run civilian affairs in Gaza after the war.,https://www.aljazeera.com/news/2024/1/4/israeli-defence-minister-outlines-new-phase-in-gaza-war,2024-01-04T21:34:29Z
Al Jazeera English,Al Jazeera,Pressure on Netanyahu amid row over Israel’s plan for ‘day after’ Gaza war,"As Israeli military pounds Gaza, raids occupied West Bank, Hamas says no deal on captives until 'aggression' stops.",https://www.aljazeera.com/news/2023/12/29/pressure-on-netanyahu-amid-row-over-israels-plan-for-day-after-gaza-war,2023-12-29T12:11:02Z
Al Jazeera English,Al Jazeera,What is Israel’s latest ‘day after’ plan for Gaza?,"In a vision laid out for post-war Gaza, defence minister Gallant said an undefined Palestinian entity will take charge.",https://www.aljazeera.com/news/2024/1/5/what-is-israels-latest-day-after-plan-for-gaza,2024-01-05T13:09:44Z
Al Jazeera English,Al Jazeera,"Israel’s war on Gaza: List of key events, day 107",Israel killed at least 165 people in the past 24 hours as Netanyahu doubles down on his refusal of a Palestinian state.,https://www.aljazeera.com/news/2024/1/21/israels-war-on-gaza-list-of-key-events-day-107,2024-01-21T07:47:42Z
Al Jazeera English,Al Jazeera,Israeli military strikes south Lebanon stoking fears of widening conflict,"Attacks on Hezbollah military infrastructure follow the killing of Hamas leader in Beirut, which Israel has not claimed.",https://www.aljazeera.com/news/2024/1/4/israeli-military-strikes-south-lebanon-stoking-fears-of-widening-conflict,2024-01-04T09:11:59Z
Al Jazeera English,Al Jazeera,"Lebanon and Israel ‘prefer’ diplomatic end to tensions, US envoy says",Hezbollah and Israel have been engaged in cross-border attacks since the early days of the war on Gaza.,https://www.aljazeera.com/news/2024/1/11/lebanon-and-israel-prefer-diplomatic-end-to-tensions-us-envoy-says,2024-01-11T17:13:59Z
Al Jazeera English,Al Jazeera,"Israel’s war on Gaza: List of key events, day 106",Footage and witness accounts reveal how Israel carried out summary executions in Gaza. Here are the other updates.,https://www.aljazeera.com/news/2024/1/20/israels-war-on-gaza-list-of-key-events-day-106,2024-01-20T07:42:14Z
Al Jazeera English,Al Jazeera,How is the White House spinning the media on the Gaza war?,"White House spin notwithstanding, Israel is proceeding exactly as the US likes, argues The Intercept's Jeremy Scahill.",https://www.aljazeera.com/program/the-bottom-line/2024/1/25/how-is-the-white-house-spinning-the-media-on-the-gaza-war,2024-01-25T10:39:59Z
Al Jazeera English,Al Jazeera,Turkey arrests dozens suspected of spying for Israel,Ankara has previously warned that it will not allow Israel to strike at Hamas inside Turkey's borders.,https://www.aljazeera.com/news/2024/1/2/turkey-detains-33-people-suspected-of-spying-on-behalf-of-israel,2024-01-02T13:12:33Z
Al Jazeera English,Al Jazeera,Israel signals bombardment of northern Gaza set to end,"The Israeli military has 'dismantled' Hamas in the north, but suggests the onslaught will continue in the rest of Gaza.",https://www.aljazeera.com/news/2024/1/7/israel-signals-bombardment-of-northern-gaza-set-to-end,2024-01-07T11:51:16Z
Al Jazeera English,Nils Adler,Palestinians in Ukraine decry ‘double standard’ as Kyiv supports Israel,"Ukraine has supported Israel throughout the latest conflict, upsetting Palestinians as war ravages Gaza.",https://www.aljazeera.com/news/2024/1/19/palestinians-in-ukraine-decry-double-standard-as-kyiv-supports-israel,2024-01-19T12:10:56Z
Al Jazeera English,Al Jazeera,Israel’s Netanyahu reiterates rejection of Palestinian state after Gaza war,US says there's 'no way' to solve Israel's long-term security challenges and rebuild Gaza without Palestinian statehood.,https://www.aljazeera.com/news/2024/1/18/israels-netanyahu-reiterates-rejection-of-palestinian-state-after-gaza-war,2024-01-18T20:07:13Z
Al Jazeera English,Al Jazeera,How will Hamas react to the killing of one of its top leaders?,Israel stands accused of killing Saleh al-Arouri by drone strike in Hezbollah's stronghold in the Lebanese capital.,https://www.aljazeera.com/program/inside-story/2024/1/3/how-will-hamas-react-to-the-killing-of-one-of-its-top-leaders,2024-01-03T17:21:21Z
Al Jazeera English,Al Jazeera,"US top diplomat Blinken meets Abbas, discusses Palestinian statehood",US secretary of state travelled to the occupied West Bank during his fourth trip to the region since Gaza war began.,https://www.aljazeera.com/news/2024/1/10/us-top-diplomat-blinken-meets-abbas-discusses-palestinian-statehood,2024-01-10T17:34:41Z
Al Jazeera English,Al Jazeera,"UN, UK push Israel on role of two-state solution to ending Gaza war",PM Netanyahu's rejection of a Palestinian state is attracting pushback.,https://www.aljazeera.com/news/2024/1/24/uks-cameron-to-raise-concerns-over-gaza-death-toll-on-israel-visit,2024-01-24T11:32:27Z
Al Jazeera English,Al Jazeera,Anti-government protesters demand new elections in Israel amid Gaza war,"Thousands of outraged Israelis, including relatives of soldiers and captives, are calling for new elections in protests.",https://www.aljazeera.com/program/newsfeed/2024/1/21/anti-government-protesters-demand-new-elections-in-israel-amid-gaza-war,2024-01-21T09:13:36Z
Al Jazeera English,Al Jazeera,Netanyahu says Gaza-Egypt border zone should be under Israeli control,The Israeli prime minister also predicts the war in Gaza and on other regional fronts would last many months.,https://www.aljazeera.com/news/2023/12/31/netanyahu-says-gaza-egypt-border-zone-should-be-under-israeli-control,2023-12-31T00:11:41Z
Al Jazeera English,Zoran Kusovac,Analysis: Is the Israeli army as militarily successful as it claims?,"As we enter 2024, the Israeli army can claim some successes in the war on Gaza — and also has failures to reckon with.",https://www.aljazeera.com/news/2024/1/1/analysis-is-the-israeli-army-as-militarily-successful-as-it-claims,2024-01-01T10:34:02Z
Al Jazeera English,Al Jazeera,Families of hostages storm Israeli parliament meeting,The demonstration signals growing anger over the fate of the hostages in the fourth month of the Gaza war.,https://www.aljazeera.com/news/2024/1/22/gaza-hostages-relatives-storm-israeli-parliament-as-protests-intensify,2024-01-22T13:42:38Z
Al Jazeera English,Al Jazeera,Hezbollah fires rockets at Israel in ‘response’ to Hamas leader’s killing,Lebanese group says it targeted Meron air base following the killing of Hamas leader Saleh al-Arouri in Beirut.,https://www.aljazeera.com/news/2024/1/6/hezbollah-fires-rockets-at-israel-in-response-to-hamas-leaders-killing,2024-01-06T10:25:57Z
Al Jazeera English,Al Jazeera,Hezbollah chief warns Lebanon could be ‘exposed’ to more Israeli attacks,"Nasrallah again pledges retaliation for killing of Hamas deputy chief al-Arouri, says Hezbollah 'cannot be silent'.",https://www.aljazeera.com/news/2024/1/5/hezbollah-chief-warns-lebanon-could-be-exposed-to-more-israeli-attacks,2024-01-05T17:09:56Z
Al Jazeera English,Al Jazeera,Protests as UN top court hears genocide case against Israel over Gaza war,"In ICJ case brought to The Hague, South Africa accuses Israel of committing genocide and demands end to offensive.",https://www.aljazeera.com/gallery/2024/1/11/protests-as-un-top-court-hears-genocide-case-against-israel-over-gaza-war,2024-01-11T13:56:08Z
Al Jazeera English,Al Jazeera,"Israel’s war on Gaza: List of key events, day 109",Dozens of Palestinians killed over the past 24 hours in Khan Younis as Israel expands its ground offensive there.,https://www.aljazeera.com/news/2024/1/23/israels-war-on-gaza-list-of-key-events-day-109,2024-01-23T07:29:57Z
Al Jazeera English,Al Jazeera,"Israel’s war on Gaza: List of key events, day 101",Dozens of Palestinians killed in overnight Israeli strikes in central and south Gaza as Red Sea tensions rise.,https://www.aljazeera.com/news/2024/1/15/israels-war-on-gaza-list-of-key-events-day-101,2024-01-15T08:57:41Z
Al Jazeera English,Al Jazeera,Israeli army launches attacks on targets in Syria and Lebanon,"As war in Gaza rages, Israel is continuing its campaign against Syrian military and Hezbollah targets.",https://www.aljazeera.com/news/2024/1/2/israeli-army-launches-attacks-on-targets-in-syria-and-lebanon,2024-01-02T14:48:58Z
Al Jazeera English,Al Jazeera,"Israel’s war on Gaza: List of key events, day 93","Six people have been killed in an Israeli air raid on Jenin in the occupied West Bank, Palestinian Health Ministry says.",https://www.aljazeera.com/news/2024/1/7/israels-war-on-gaza-list-of-key-events-day-92-3,2024-01-07T09:30:54Z
Al Jazeera English,Al Jazeera,"Israel’s war on Gaza: List of key events, day 92",At least 18 people have been killed in an Israeli air attack in Gaza's Khan Younis city. Here are the updates.,https://www.aljazeera.com/news/2024/1/6/israels-war-on-gaza-list-of-key-events-day-92,2024-01-06T08:37:53Z
Al Jazeera English,Al Jazeera,"US diplomat Blinken meets Turkey’s Erdogan, kicking off Gaza diplomacy tour","The US secretary of state will also travel to Israel and the occupied West Bank, as the war in Gaza rages on.",https://www.aljazeera.com/news/2024/1/6/us-diplomat-blinken-meets-turkeys-erdogan-kicking-off-gaza-diplomacy-tour,2024-01-06T16:25:29Z
Al Jazeera English,Al Jazeera,‘Let’s talk about it’: EU’s Borrell presses Israel on two-state solution,EU foreign policy chief says Israel's plan to destroy Hamas in Gaza is not working as bloc's foreign ministers meet.,https://www.aljazeera.com/news/2024/1/22/lets-talk-about-it-eus-borrell-presses-israel-on-two-state-solution,2024-01-22T11:15:32Z
Al Jazeera English,Al Jazeera,Photos: Israel’s war on Gaza’s children,"Gaza dubbed 'a graveyard' for children as more than 8,000 children killed and thousands displaced by Israel's war.",https://www.aljazeera.com/gallery/2023/12/28/photos-gaza-children,2023-12-28T15:23:42Z
Al Jazeera English,Al Jazeera,"Hamas says October 7 attack was a ‘necessary step’, admits to ‘some faults’",The Palestinian group provides its account of the assault on communities in southern Israel.,https://www.aljazeera.com/news/2024/1/21/hamas-says-october-7-attack-was-a-necessary-step-admits-to-some-faults,2024-01-21T19:31:00Z
Al Jazeera English,Al Jazeera,Israel’s war on Gaza: 100 days of death and suffering,"Israeli bombardment in past 100 days has killed nearly 24,000 Palestinians - about one percent of Gaza's population.",https://www.aljazeera.com/gallery/2024/1/14/israels-war-on-gaza-100-days-of-death-and-suffering,2024-01-14T13:51:29Z
Al Jazeera English,Al Jazeera,"Israel’s war on Gaza: List of key events, day 96",UN officials have warned that the Gaza Strip is becoming uninhabitable. Here are the latest updates.,https://www.aljazeera.com/news/2024/1/10/israels-war-on-gaza-list-of-key-events-day-96,2024-01-10T07:11:18Z
Al Jazeera English,Al Jazeera,"Israel’s war on Gaza: List of key events, day 112","An Israeli attack killed 20 waiting on aid in Gaza, heavy fighting is under way at hospitals.",https://www.aljazeera.com/news/2024/1/26/israels-war-on-gaza-list-of-key-events-day-112,2024-01-26T06:58:31Z
Al Jazeera English,Al Jazeera,"Israel’s war on Gaza: List of key events, day 94",Son of Al Jazeera journalist was killed by an Israeli missile and Al-Aqsa Hospital was evacuated. Here's the latest.,https://www.aljazeera.com/news/2024/1/8/israels-war-on-gaza-list-of-key-events-day-94,2024-01-08T07:51:29Z
Al Jazeera English,Simon Speakman Cordall,Why is Lebanon home to so many Palestinian refugees and leaders?,"An estimated 270,000 Palestinians live in the country. Their story is one of war, displacement and a struggle to return.",https://www.aljazeera.com/news/2024/1/6/why-is-lebanon-home-to-so-many-palestinian-refugees-and-leaders,2024-01-06T08:21:04Z
Al Jazeera English,Al Jazeera,Israel embassy pulls ‘inappropriate’ video imagining Hamas attack on Seoul,South Korea objected to footage posted by Israeli embassy depicting hypothetical abduction of a mother in Seoul.,https://www.aljazeera.com/news/2023/12/28/israel-embassy-pulls-inappropriate-video-imagining-hamas-attack-on-seoul,2023-12-28T11:33:00Z
Al Jazeera English,Al Jazeera,Palestinians welcome Chile and Mexico’s call for ICC probe into Gaza war,Two countries express 'growing worry' over 'escalation of violence' in International Criminal Court referral.,https://www.aljazeera.com/news/2024/1/19/palestinians-welcome-chile-and-mexico-call-for-icc-probe-into-gaza-war,2024-01-19T10:02:13Z
Al Jazeera English,Mimi Kirk,Christian Zionist cowboys: American and Israeli affinities laid bare,The American cowboys flocking to Israel amid its war on Gaza expose the parallels between the two settler societies.,https://www.aljazeera.com/opinions/2024/1/19/christian-zionist-cowboys-american-and-israeli-affinities-laid-bare,2024-01-19T14:00:13Z
Al Jazeera English,Al Jazeera,Hezbollah chief says group won’t ‘be silent’ after killing of Hamas leader,Sayyed Hassan Nasrallah offers condolences to Hamas after the killing of its deputy leader Saleh al-Arouri.,https://www.aljazeera.com/news/2024/1/3/hezbollah-chief-says-group-wont-be-silent-after-killing-of-hamas-leader,2024-01-03T19:13:06Z
Al Jazeera English,Al Jazeera,Israel says it will pull out thousands of troops from Gaza,"Israel has come under pressure from its principal ally, the United States, to move to a more low-intensity war.",https://www.aljazeera.com/news/2024/1/1/israel-says-it-will-pull-out-thousands-of-troops-from-gaza,2024-01-01T20:30:56Z
