Source,Author,Title,Description,URL,Published At
BBC News,https://www.facebook.com/bbcnews,"Hamas command in north Gaza destroyed, Israel says","Three months into the Gaza war, the militants are ""without commanders"" in the area, the IDF say.",https://www.bbc.co.uk/news/world-middle-east-67904259,2024-01-06T20:36:02Z
BBC News,https://www.facebook.com/bbcnews,"100 days since Hamas attacked Israel, triggering war in Gaza",Thousands of Israelis gathered in Tel Aviv to mark 100 days since the start of the unprecedented war against Hamas.,https://www.bbc.co.uk/news/world-middle-east-67972962,2024-01-14T07:53:26Z
BBC News,https://www.facebook.com/bbcnews,Israel Gaza war: Hamas video claims to show dead hostages,"The militants say the two men were killed in air strikes on Gaza, an allegation denied by Israel.",https://www.bbc.co.uk/news/world-middle-east-67987097,2024-01-15T21:55:26Z
BBC News,https://www.facebook.com/bbcnews,Israel-Palestinian bitterness deepened by Hamas attack and war,Both Israelis and Palestinians believe the world does not understand their pain and suffering.,https://www.bbc.co.uk/news/world-middle-east-67893122,2024-01-07T09:30:05Z
BBC News,https://www.facebook.com/bbcnews,"More than 25,000 now killed in Gaza, Hamas-run health ministry says",The grim milestone comes as Israel presses its war in Gaza and rejects calls for a Palestinian state.,https://www.bbc.co.uk/news/world-middle-east-68050172,2024-01-21T16:28:20Z
BBC News,https://www.facebook.com/bbcnews,Eisenkot: Key Israeli war leader challenges Netanyahu over Gaza strategy,"Gadi Eisenkot condemns the prime minister, who insists Israel's offensive will go on until ""complete victory"".",https://www.bbc.co.uk/news/world-middle-east-68035744,2024-01-19T18:35:37Z
BBC News,https://www.facebook.com/bbcnews,"Israel Gaza war: Deal reached on aid to Gaza, including to hostages","Under the deal, brokered by Qatar and France, new aid is to reach both Gaza civilians and Israeli hostages.",https://www.bbc.co.uk/news/world-middle-east-68000227,2024-01-16T20:57:48Z
BBC News,https://www.facebook.com/bbcnews,Saleh al-Arouri: Thousands attend Hamas deputy leader's funeral in Beirut,"Al-Arouri, a deputy political leader of Hamas, was killed in an attack in Beirut on Tuesday.",https://www.bbc.co.uk/news/world-middle-east-67884392,2024-01-04T17:36:21Z
BBC News,https://www.facebook.com/bbcnews,Israel-Gaza war: The huge challenges facing Israel's 'day after' plan,Paul Adams examines the Gaza proposal - which is little more than a series of bullet points.,https://www.bbc.co.uk/news/world-middle-east-67891893,2024-01-06T12:37:17Z
BBC News,https://www.facebook.com/bbcnews,Police record rise in religious hate crimes after Israel-Gaza war,An increase in antisemitism and Islamophobia is reported by major UK police forces.,https://www.bbc.co.uk/news/uk-67836607,2023-12-29T00:44:05Z
BBC News,https://www.facebook.com/bbcnews,South Africa's genocide case against Israel: Both sides play heavy on emotion in ICJ hearing,"After two days of legal argument, judges must now rule on whether Israel is committing genocide in Gaza.",https://www.bbc.co.uk/news/world-middle-east-67962302,2024-01-12T20:59:40Z
BBC News,https://www.facebook.com/bbcnews,Khan Younis: Israel says forces have encircled Gaza's second city,"Fighting is reported around hospitals in the city, where Israel believes Hamas leaders are hiding.",https://www.bbc.co.uk/news/world-middle-east-68074566,2024-01-23T21:15:25Z
BBC News,https://www.facebook.com/bbcnews,"Gaza war creating a radicalisation moment, senior UK police officer says",A senior police officer warns the conflict could push more people towards terrorism.,https://www.bbc.co.uk/news/uk-68035172,2024-01-19T16:43:33Z
BBC News,https://www.facebook.com/bbcnews,"Gaza destruction risks lost generation of children, says UN official",A senior UN official tells the BBC that civilians may have no choice but to leave entirely,https://www.bbc.co.uk/news/world-middle-east-68023080,2024-01-19T11:28:30Z
BBC News,https://www.facebook.com/bbcnews,UK officials probe Iran generals' antisemitic talks to students,"A watchdog is investigating videos of online speeches urging students to join an ""apocalyptic war"".",https://www.bbc.co.uk/news/uk-68016330,2024-01-22T22:00:43Z
BBC News,https://www.facebook.com/bbcnews,UN court to hear South Africa genocide case against Israel,"Israel rejects South Africa's accusation that its actions in Gaza are ""genocidal in character"".",https://www.bbc.co.uk/news/world-middle-east-67942983,2024-01-11T07:16:13Z
BBC News,https://www.facebook.com/bbcnews,UK had no choice but to strike Houthis - Cameron,Foreign Secretary Lord Cameron suggests the UK could strike Houthi targets again if attacks on ships continue.,https://www.bbc.co.uk/news/uk-67972796,2024-01-14T04:24:58Z
BBC News,https://www.facebook.com/bbcnews,Houthi missile hits US-owned container ship in Gulf of Aden,"The vessel, Gibraltar Eagle, reported ""no injuries or significant damage"", according to the US military.",https://www.bbc.co.uk/news/world-middle-east-67986226,2024-01-15T19:34:34Z
BBC News,https://www.facebook.com/bbcnews,Why 2023 was an uncomfortable year for the West,"This year has seen a series of setbacks, writes Frank Gardner, but there are also glimmers of hope.",https://www.bbc.co.uk/news/world-67845056,2023-12-30T01:06:21Z
BBC News,https://www.facebook.com/bbcnews,Yemen: US shoots down missile from Houthi-run area aimed at warship,A fighter jet downs the missile fired from a Houthi-run area following US-UK strikes in Yemen.,https://www.bbc.co.uk/news/world-middle-east-67978143,2024-01-15T05:29:13Z
BBC News,https://www.facebook.com/bbcnews,Israel outlines its plans for Gaza after war,The plans are unveiled by its defence minister as fighting rages on in the Palestinian territory.,https://www.bbc.co.uk/news/world-middle-east-67888794,2024-01-05T00:40:29Z
BBC News,https://www.facebook.com/bbcnews,Hamas deputy leader Saleh al-Arouri's assassination sparks wider war fears,Lyse Doucet assesses if Hezbollah and Hamas will retaliate after Saleh al-Houri was killed in Lebanon.,https://www.bbc.co.uk/news/world-middle-east-67873573,2024-01-03T12:58:35Z
BBC News,https://www.facebook.com/bbcnews,Israel Gaza war: Israeli minister warns Hezbollah over border fighting,Cross-border exchanges of fire have been escalating since Hamas's attacks on Israel on 7 October.,https://www.bbc.co.uk/news/world-middle-east-67831478,2023-12-28T05:59:06Z
BBC News,https://www.facebook.com/bbcnews,ICJ says Israel must prevent genocide in Gaza,"But it stops short of ordering Israel to halt the war in Gaza, in a controversial case at The Hague.",https://www.bbc.co.uk/news/world-middle-east-68108260,2024-01-26T16:54:33Z
BBC News,https://www.facebook.com/bbcnews,Qatar 'appalled' by reported criticism from Israel's Netanyahu,"The Israeli PM was apparently recorded calling its role as a mediator in the Gaza war ""problematic"".",https://www.bbc.co.uk/news/world-middle-east-68091659,2024-01-25T14:28:52Z
BBC News,https://www.facebook.com/bbcnews,Gaza war: ICJ to rule on call for Israel to stop military action,"The ICJ could order Israel to stop military action, in a high-profile case brought by South Africa.",https://www.bbc.co.uk/news/world-middle-east-68059715,2024-01-26T00:03:52Z
BBC News,https://www.facebook.com/bbcnews,South Africa files 'genocide' case against Israel at ICJ,"Israel rejects ""with disgust"" the allegation, calling it ""baseless"".",https://www.bbc.co.uk/news/world-africa-67844551,2023-12-29T21:19:08Z
BBC News,,100 days of Gaza war: The scale of destruction,Drone shots taken in Gaza show the extent of destruction in the enclave after 100 days of war.,https://www.bbc.co.uk/news/av/world-middle-east-67977694,2024-01-15T04:52:29Z
BBC News,https://www.facebook.com/bbcnews,Trudeau balancing act on Israel-Gaza annoys both sides of debate,Canada's prime minister has been criticised for failing to define his country's stance on the war.,https://www.bbc.co.uk/news/world-us-canada-68037261,2024-01-19T22:46:37Z
BBC News,https://www.facebook.com/bbcnews,Eurovision: Finnish artists want Israel barred from Eurovision over Gaza war,"More than 1,400 music professionals demand action from public broadcaster Yle.",https://www.bbc.co.uk/news/entertainment-arts-67941086,2024-01-10T21:38:17Z
BBC News,https://www.facebook.com/bbcnews,Israel to fight South Africa's Gaza genocide claim in court,"South Africa accused Israel of committing genocide in Gaza, triggering Israeli outrage.",https://www.bbc.co.uk/news/world-middle-east-67866342,2024-01-02T16:56:07Z
BBC News,https://www.facebook.com/bbcnews,Record number of civilians hurt by explosives in 2023,"The war in Gaza is largely responsible, UK-based charity Action on Armed Violence says.",https://www.bbc.co.uk/news/world-67915770,2024-01-09T00:00:32Z
BBC News,https://www.facebook.com/bbcnews,Turkey detains 34 on suspicion of spying for Israel,Investigators allege the suspects were planning abductions on behalf of Israeli intelligence.,https://www.bbc.co.uk/news/world-europe-67861377,2024-01-02T17:47:53Z
BBC News,https://www.facebook.com/bbcnews,Israel Gaza war: Yemen's Houthis warned against new attacks on shipping in Red Sea,"The US, UK and ten other states warn Yemen's rebels they will face consequences if attacks persist.",https://www.bbc.co.uk/news/world-middle-east-67878906,2024-01-04T02:10:41Z
BBC News,https://www.facebook.com/bbcnews,Antony Blinken: On the US mission to stop Gaza igniting wider war,The US secretary of state wants to prevent the war escalating but the cauldron of tensions could boil over.,https://www.bbc.co.uk/news/world-middle-east-67911825,2024-01-08T21:17:37Z
BBC News,https://www.facebook.com/bbcnews,Who are the Houthi rebels and why are they attacking Red Sea ships?,The Houthi rebels in Yemen have vowed to attack all ships in the Red Sea bound for Israel.,https://www.bbc.co.uk/news/world-middle-east-67614911,2024-01-12T01:06:02Z
BBC News,https://www.facebook.com/bbcnews,What is South Africa’s genocide case against Israel at the ICJ?,The International Court of Justice (ICJ) will consider whether Israel is committing genocide in Gaza.,https://www.bbc.co.uk/news/world-middle-east-67922346,2024-01-10T13:12:12Z
BBC News,https://www.facebook.com/bbcnews,Tough choices for Israel in US's Middle East vision,"Anthony Zurcher, who accompanied Secretary of State Antony Blinken on his tour, assesses his plan.",https://www.bbc.co.uk/news/world-middle-east-67949952,2024-01-13T00:02:05Z
BBC News,https://www.facebook.com/bbcnews,Khan Younis: UN says blasts kill nine at Gaza shelter as fighting rages,The UN Palestinian refugee agency says tank shells hit a training college sheltering displaced people.,https://www.bbc.co.uk/news/world-middle-east-68078580,2024-01-24T17:41:29Z
BBC News,https://www.facebook.com/bbcnews,Netanyahu publicly rejects US push for Palestinian state,The Israeli PM's rejection of Washington's efforts shows the growing disagreement between the two allies.,https://www.bbc.co.uk/news/world-middle-east-68025945,2024-01-18T21:22:15Z
BBC News,https://www.facebook.com/bbcnews,Biden: US will respond if Houthis continue 'outrageous' attacks,The Yemeni group says Friday's airstrikes mean US and UK interests are now legitimate targets.,https://www.bbc.co.uk/news/world-middle-east-67962769,2024-01-12T22:39:35Z
BBC News,https://www.facebook.com/bbcnews,US launches second strike on Houthis in Yemen,"The ""follow-on action"" comes after the first US and UK military response to Houthi attacks on shipping.",https://www.bbc.co.uk/news/world-middle-east-67967233,2024-01-13T14:18:08Z
BBC News,https://www.facebook.com/bbcnews,Police probe alleged foul-smelling substance attack on Gaza march,"Students at Columbia University say they were doused with a foul-smelling substance, akin to sewage.",https://www.bbc.co.uk/news/world-us-canada-68075715,2024-01-23T19:27:54Z
BBC News,https://www.facebook.com/bbcnews,Why did Iran launch strikes on its allies' territory?,"Iranian attacks hit targets in Syria, Iraq and Pakistan over two days. Why, and why now?",https://www.bbc.co.uk/news/world-middle-east-68021483,2024-01-18T18:17:45Z
BBC News,https://www.facebook.com/bbcnews,Hard choices for the West in Red Sea stand-off,"Most of the world deplores the Houthi attacks on shipping, but there are barriers which make it difficult for the West to stop them.",https://www.bbc.co.uk/news/world-middle-east-67938290,2024-01-10T23:12:51Z
BBC News,https://www.facebook.com/bbcnews,Israel footballer faces Turkey sack for hostage plea,"Sagiv Jehezkel held up a bandaged hand that read ""100 days. 7/10"", a reference to Hamas's 7 October attacks.",https://www.bbc.co.uk/news/world-europe-67978736,2024-01-15T10:00:27Z
BBC News,BBC Sport,Israel barred from international ice hockey,The International Ice Hockey Federation bars Israel from competing in its world championship events over safety concerns.,https://www.bbc.co.uk/sport/ice-hockey/67951801,2024-01-11T18:09:42Z
BBC News,Eshlin Vedan,Axing of SA cricket captain sparks antisemitism row,Cricket South Africa officials say they demoted David Teeger because of safety concerns after his comments about the Gaza conflict.,https://www.bbc.co.uk/sport/africa/67957459,2024-01-12T16:10:19Z
BBC News,https://www.facebook.com/bbcnews,"US, UK weigh striking Houthis...","US, UK weigh striking Houthis...

 
 
 
 (Second column, 7th story, link)

 

 

 
 Related stories:Iran Captures Oil Tanker in Deepening Mideast Turmoil...
S Africa presents genocide case against Israel at UN court...",https://www.bbc.co.uk/news/live/world-us-canada-67952029,2024-01-11T20:49:38Z
BBC News,https://www.facebook.com/bbcnews,Hamas deputy leader Saleh al-Arouri killed in Beirut blast,Saleh al-Arouri is the most senior Hamas figure killed since the Israel-Hamas war began in October.,https://www.bbc.co.uk/news/world-middle-east-67866346,2024-01-02T17:59:01Z
BBC News,https://www.facebook.com/bbcnews,Palestinian envoy Husam Zomlot says UK guilty of hypocrisy,"Husam Zomlot says the UK's policies towards Israel has caused it ""reputational damage"".",https://www.bbc.co.uk/news/uk-67999094,2024-01-16T18:33:01Z
BBC News,https://www.facebook.com/bbcnews,Israel says war in Gaza expected to continue throughout 2024,"In a new year message, Israel's military says it expects fighting in Gaza for the rest of the year.",https://www.bbc.co.uk/news/world-middle-east-67855117,2024-01-01T02:43:27Z
BBC News,,Young Gazans hope for peace in new year as war with Israel goes on,Young Palestinians tell the BBC they want a return to peace and normality in 2024.,https://www.bbc.co.uk/news/av/world-middle-east-67854246,2023-12-31T17:54:46Z
BBC News,https://www.facebook.com/bbcnews,McDonald's hit by Israel-Gaza 'misinformation',It is a striking acknowledgment of the impact from the conflict on the burger giant.,https://www.bbc.co.uk/news/business-67885910,2024-01-04T20:43:39Z
BBC News,https://www.facebook.com/bbcnews,Saudi Arabia interested in Israel normalisation deal after war,The Saudi ambassador to the UK says any agreement must lead to the creation of a Palestinian state.,https://www.bbc.co.uk/news/world-middle-east-67922238,2024-01-09T14:11:11Z
BBC News,https://www.facebook.com/bbcnews,What is behind Turkey's staunch support for Hamas in Gaza?,"Turkey has vociferously criticised Israel during the Gaza war, risking recently rebuilt relations.",https://www.bbc.co.uk/news/world-europe-67861266,2024-01-02T15:50:59Z
BBC News,https://www.facebook.com/bbcnews,Yemen strikes 'embolden' extremists - former ambassador,"Frances Guy says the UK and US governments should ""call Houthi rebels' bluff' and pursue a ceasefire in Gaza.",https://www.bbc.co.uk/news/uk-scotland-67968001,2024-01-13T18:29:12Z
BBC News,https://www.facebook.com/bbcnews,"Israel-Gaza war: Displaced Gazans 'living in the open', UN says","The southern city of Rafah saw an influx of 100,000 people seeking shelter in recent days, UN says.",https://www.bbc.co.uk/news/world-middle-east-67849224,2023-12-30T16:30:06Z
BBC News,https://www.facebook.com/bbcnews,Mediators push for Gaza ceasefire deal but gaps remain between Israel and Hamas,"Indirect talks have brought no breakthrough, but neither Israel nor Hamas have abandoned them.",https://www.bbc.co.uk/news/world-middle-east-68084402,2024-01-24T16:35:20Z
BBC News,https://www.facebook.com/bbcnews,Young Britons exposed to online radicalisation following Hamas attack,There has been a 12-fold increase in hateful social media content being referred to specialist police officers.,https://www.bbc.co.uk/news/uk-67884785,2024-01-06T01:10:51Z
BBC News,https://www.facebook.com/bbcnews,Hezbollah missile attack kills Israeli woman and son,A woman in her seventies and her son have been killed by an anti-tank missile attack on northern Israel.,https://www.bbc.co.uk/news/world-middle-east-67975815,2024-01-14T20:43:44Z
BBC News,https://www.facebook.com/bbcnews,"Medicine to be delivered to Gaza hostages under new agreement, says Israeli PM",Qatar has helped agree a deal between Israel and Hamas after families of hostages raised concerns.,https://www.bbc.co.uk/news/world-middle-east-67965009,2024-01-12T20:57:43Z
BBC News,,'This is my home’ – a 13-year-old vlogger's life in Gaza,"Nadine Abdul Latif moved home three times since the war began, and an Israeli air strike killed her brother.",https://www.bbc.co.uk/news/av/world-middle-east-67952301,2024-01-11T17:53:08Z
BBC News,https://www.facebook.com/bbcnews,Palestinians tell of fears for the future as war destroys Gaza,Palestinians in Gaza tell of fears for the future - and of returning to the past.,https://www.bbc.co.uk/news/world-middle-east-68034128,2024-01-20T00:34:59Z
BBC News,,David Lammy speech heckled by pro-Palestinian protesters,The shadow foreign secretary was in London delivering a speech on foreign policy.,https://www.bbc.co.uk/news/av/uk-politics-68044558,2024-01-20T18:26:15Z
BBC News,https://www.facebook.com/bbcnews,Namibia criticises German support for Israel over ICJ genocide case,Germany officially acknowledged committing genocide during its colonial occupation of Namibia in 2021.,https://www.bbc.co.uk/news/world-africa-67974067,2024-01-14T12:29:15Z
BBC News,https://www.facebook.com/bbcnews,"Saleh al-Arouri: Hamas leader's death 'won't go unpunished', says Hezbollah chief",The head of Lebanon's largest military force says the death of Saleh al-Arouri will be avenged.,https://www.bbc.co.uk/news/world-middle-east-67875508,2024-01-03T20:47:45Z
BBC News,https://www.facebook.com/bbcnews,Israel says South Africa distorting the truth in ICJ genocide case,Its lawyer rebuffs South Africa's accusations while defending actions in Gaza at the UN's top court.,https://www.bbc.co.uk/news/world-middle-east-67944903,2024-01-12T10:49:24Z
BBC News,https://www.facebook.com/bbcnews,"Iran must tell Houthis to cease and desist, says Grant Shapps","The UK defence secretary says the world is ""running out of patience"" with attacks.",https://www.bbc.co.uk/news/uk-67967372,2024-01-13T09:14:58Z
BBC News,,Israel Gaza: Palestinian girl shows bombed remains of house next door,Nadin Abdullatif shows destroyed beds and pillows in the rubble after a deadly Israeli strike.,https://www.bbc.co.uk/news/av/world-middle-east-67844374,2023-12-29T18:20:27Z
BBC News,https://www.facebook.com/bbcnews,"Israel: Woman killed, 12 hurt in suspected Palestinian car-ramming attack",Two Palestinians are arrested after several cars are used in what police say was a terrorist attack.,https://www.bbc.co.uk/news/world-middle-east-67983624,2024-01-15T14:00:26Z
BBC News,https://www.facebook.com/bbcnews,Red Sea: UK defence secretary says British forces will repel Houthi attacks,The defence secretary says British forces will take direct action against Houthi rebels targeting vessels in the key shipping lane.,https://www.bbc.co.uk/news/uk-67855304,2024-01-01T02:40:41Z
BBC News,https://www.facebook.com/bbcnews,Stephen Flynn fears 'wider regional crisis' after Yemen air strikes,SNP Westminster leader Stephen Flynn also says the failure to consult MPs in advance was 'farcical'.,https://www.bbc.co.uk/news/uk-scotland-scotland-politics-67974168,2024-01-14T12:39:57Z
BBC News,https://www.facebook.com/bbcnews,Suspected Israeli strike in Lebanon kills senior Hezbollah commander,"Hezbollah confirmed the death of Wissam Tawil, marking a further escalation of tensions with Israel.",https://www.bbc.co.uk/news/world-middle-east-67914727,2024-01-08T17:03:48Z
BBC News,https://www.facebook.com/bbcnews,Huge diplomacy over Gaza war - but little hope for those suffering,"There's a chasm between what Gaza needs and what it's receiving, writes Quentin Sommerville.",https://www.bbc.co.uk/news/world-middle-east-68097993,2024-01-27T11:29:28Z
BBC News,https://www.facebook.com/bbcnews,Understanding a week of missile strikes across Middle East,"From the Red Sea to Gaza to Iran, the past week has deepened fears of conflict spreading.",https://www.bbc.co.uk/news/world-middle-east-68017051,2024-01-21T01:01:57Z
BBC News,https://www.facebook.com/bbcnews,Gaza journalists’ families reject Israeli military's ‘terrorist’ claims,An Al Jazeera journalist and a freelancer were killed in an Israeli air strike in Rafah on Sunday.,https://www.bbc.co.uk/news/world-middle-east-67946441,2024-01-11T20:49:16Z
BBC News,https://www.facebook.com/bbcnews,Intense Israeli strikes in south Gaza city as hostages sent medicine,"Khan Younis residents report intense fighting, as Qatar says Hamas will give medicines to hostages.",https://www.bbc.co.uk/news/world-middle-east-68004449,2024-01-17T10:38:58Z
BBC News,https://www.facebook.com/bbcnews,Oil prices rise after Iran seizes oil tanker,"The incident raises prospects of growing conflict in the Middle East, which could impact UK fuel prices.",https://www.bbc.co.uk/news/business-67946344,2024-01-11T18:03:50Z
BBC News,https://www.facebook.com/bbcnews,Palestinians must be able to stay in Gaza - Blinken,The US secretary of state criticises Israeli ministers calling for the resettlement of Gazans.,https://www.bbc.co.uk/news/world-middle-east-67907336,2024-01-07T22:02:45Z
BBC News,https://www.facebook.com/bbcnews,Newspaper headlines: 'UK ready to strike again' and '100 days of hell',Sunday's papers continue their coverage of the Red Sea crisis and the ongoing conflict in Gaza.,https://www.bbc.co.uk/news/blogs-the-papers-67972528,2024-01-13T23:36:49Z
BBC News,https://www.facebook.com/bbcnews,Israeli border residents demand action as Hezbollah clashes escalate,"As fighting spirals, Israelis living near Lebanon worry about a full-scale attack by Hezbollah.",https://www.bbc.co.uk/news/world-middle-east-67921167,2024-01-09T10:39:35Z
BBC News,https://www.facebook.com/bbcnews,US demands Israel conduct full investigation into Palestinian-American teen's killing,"Tawfic Abdel Jabbar, 17, was killed in the Israeli-occupied West Bank on Friday, his family said.",https://www.bbc.co.uk/news/world-us-canada-68038149,2024-01-22T22:33:41Z
BBC News,https://www.facebook.com/bbcnews,David Cameron worried Israel may have broken international law in Gaza,The former PM said he regularly consults government lawyers over incidents in the Israel-Gaza war.,https://www.bbc.co.uk/news/uk-politics-67929003,2024-01-09T20:06:01Z
BBC News,https://www.facebook.com/bbcnews,Iran's sudden strikes show just how perilous region has become,"Iran wanted a message to be heard loud and clear - at home, and a long way beyond.",https://www.bbc.co.uk/news/world-middle-east-68017444,2024-01-20T00:43:03Z
BBC News,https://www.facebook.com/bbcnews,Thousands of Palestinians flee central Gaza as Israeli troops advance,Israeli tanks reportedly reach the outskirts of Bureij refugee camp as the ground offensive expands.,https://www.bbc.co.uk/news/world-middle-east-67834432,2023-12-28T19:58:06Z
BBC News,https://www.facebook.com/bbcnews,US condemns Iran for 'reckless' attacks on Iraq,"Iran says it struck Israeli ""spy headquarters"" in northern Iraq with ballistic missiles.",https://www.bbc.co.uk/news/world-middle-east-67989193,2024-01-16T05:04:15Z
BBC News,https://www.facebook.com/bbcnews,"Inflation risk from Red Sea disruption, warns economist","Attacks on global shipping could push up prices and quash interest rate cuts, a leading economist says.",https://www.bbc.co.uk/news/business-67980256,2024-01-15T11:06:34Z
BBC News,https://www.facebook.com/bbcnews,Newspaper headlines: Cost of Red Sea attacks and 'virtual rape' investigated,The i reports on fears Red Sea attacks on ships will have a knock-on effect on key supplies to the UK.,https://www.bbc.co.uk/news/blogs-the-papers-67859974,2024-01-01T23:48:45Z
BBC News,https://www.facebook.com/bbcnews,Israeli ex-hostage returns to site of Nova festival massacre and kidnappings,Survivors and relatives of those killed or kidnapped pay emotional visits to the festival site for a memorial event.,https://www.bbc.co.uk/news/world-middle-east-67893123,2024-01-05T17:24:30Z
BBC News,https://www.facebook.com/bbcnews,Kuenssberg: The thorny politics of Houthi strikes for Sunak and Starmer,The PM and the Labour leader agree on military action but it could be just the beginning of their problems.,https://www.bbc.co.uk/news/uk-politics-67843756,2024-01-13T15:41:51Z
BBC News,https://www.facebook.com/bbcnews,They were Israel's eyes on the border - but their Hamas warnings went unheard,A unit of young female soldiers warned of a big attack. They were among the first Hamas killed on 7 October.,https://www.bbc.co.uk/news/world-middle-east-67958260,2024-01-15T00:19:44Z
